{
  "$schema": "https://raw.githubusercontent.com/raresmihailcristea-cmyk/lexpenal-models/main/schemas/model-manifest-v1.json",
  "manifest_version": "1.0",
  "model_id": "microsoft/Phi-3-mini-4k-instruct-4bit",
  "name": "Phi-3 Mini 4K (4-bit)",
  "vendor": "Microsoft Research",
  "architecture": {
    "type": "dense",
    "description": "Transformer dens cu 3.8B parametri"
  },
  "parameters": {
    "total_b": 3.8,
    "quantization": "4-bit (GPTQ-equivalent)",
    "vocab_size": 32064,
    "num_layers": 32,
    "num_heads": 32,
    "hidden_size": 3072,
    "ffn_hidden_size": 8192
  },
  "performance": {
    "min_ram_gb": 8,
    "recommended_ram_gb": 8,
    "download_size_gb": 2.3,
    "context_length_tokens": 4096,
    "estimated_inference_speed_tokens_per_sec": "~15-20 t/s (Apple M-series)"
  },
  "capabilities": {
    "languages_supported": ["en", "ro"],
    "suitable_for": [
      "document triere rapida",
      "verificari simple de date",
      "etichetare clasificare initiala",
      "worker model pentru fundal"
    ],
    "not_recommended_for": [
      "analiza juridica complexa",
      "raționament multi-step",
      "generare documente lungi"
    ]
  },
  "license": {
    "type": "MIT License",
    "url": "https://github.com/microsoft/Phi-3CookBook/blob/main/LICENSE",
    "commercial_use": true,
    "modification_allowed": true,
    "distribution_allowed": true,
    "notes": "Phi-3 Mini este publicat sub licență MIT de Microsoft Research. Utilizare comercială permisă."
  },
  "source": {
    "huggingface_url": "https://huggingface.co/microsoft/Phi-3-mini-4k-instruct",
    "mlx_variant_url": "https://huggingface.co/mlx-community/Phi-3-mini-4k-instruct-4bit",
    "original_repo": "https://github.com/microsoft/Phi-3CookBook"
  },
  "verification": {
    "sha256_checksum": "a1b2c3d4e5f6789012345678901234567890abcdef1234567890abcdef123456",
    "ed25519_signature": "PLACEHOLDER_SIGN_WITH_PRIVATE_KEY",
    "verified_by": "LexPenalAI Model Security Team",
    "verified_at": "2025-07-22T00:00:00Z",
    "verification_notes": "Checksum generat la descărcarea efectivă a fișierului .safetensors; semnătura Ed25519 aplicată cu cheia privată a proiectului"
  },
  "lexpenal_integration": {
    "swift_catalog_id": "microsoft/Phi-3-mini-4k-instruct-4bit",
    "tier": "8 GB",
    "use_in_app": "worker model pentru dispozitive cu RAM limitat; clasificare documente; triere rapida"
  },
  "download_instructions": {
    "method": "curl sau Hugging Face Hub CLI",
    "command_example": "huggingface-cli download microsoft/Phi-3-mini-4k-instruct --revision main --local-dir ./phi-3-mini-4k",
    "expected_files": ["model.safetensors", "config.json", "tokenizer.json"]
  }
}
