{
  "$schema": "https://raw.githubusercontent.com/raresmihailcristea-cmyk/lexpenal-models/main/schemas/model-manifest-v1.json",
  "manifest_version": "1.0",
  "model_id": "mlx-community/Phi-3-mini-4k-instruct-4bit",
  "name": "Phi-3 Mini 4K (4-bit)",
  "vendor": "Microsoft Research",
  "architecture": {
    "type": "dense"
  },
  "parameters": {
    "total_b": 3.8,
    "quantization": "4-bit"
  },
  "performance": {
    "min_ram_gb": 8,
    "recommended_ram_gb": 8,
    "download_size_gb": 2.3,
    "context_length_tokens": 4096,
    "estimated_inference_speed_tokens_per_sec": "~15-20 t/s (Apple M-series)"
  },
  "capabilities": {
    "languages_supported": [
      "en",
      "ro"
    ],
    "suitable_for": [
      "worker de triere rapidă și verificări simple"
    ]
  },
  "license": {
    "type": "MIT License",
    "url": "https://github.com/microsoft/Phi-3CookBook/blob/main/LICENSE",
    "commercial_use": true
  },
  "source": {
    "huggingface_url": "https://huggingface.co/mlx-community/Phi-3-mini-4k-instruct-4bit"
  },
  "verification": {
    "sha256_checksum": "",
    "ed25519_signature": "",
    "verification_notes": "NEVERIFICAT ÎNCĂ: checksum-ul se generează cu generate_checksums.sh după descărcarea greutăților .safetensors, iar semnătura Ed25519 se aplică cu cheia privată a proiectului (Secret Manager backend). Aplicația tratează câmpurile goale ca „integritate neverificată”, nu ca eroare."
  },
  "lexpenal_integration": {
    "swift_catalog_id": "mlx-community/Phi-3-mini-4k-instruct-4bit",
    "tier": "8 GB",
    "use_in_app": "worker de triere rapidă și verificări simple"
  },
  "download_instructions": {
    "method": "Hugging Face Hub (automat, prin runtime-ul MLX din aplicație)",
    "expected_files": [
      "*.safetensors",
      "config.json",
      "tokenizer.json"
    ]
  }
}
