{
  "$schema": "https://raw.githubusercontent.com/raresmihailcristea-cmyk/lexpenal-models/main/schemas/model-manifest-v1.json",
  "manifest_version": "1.0",
  "model_id": "mlx-community/Llama-3.3-70B-Instruct-4bit",
  "name": "Llama 3.3 70B (4-bit)",
  "vendor": "Meta",
  "architecture": {
    "type": "dense"
  },
  "parameters": {
    "total_b": 70.0,
    "quantization": "4-bit"
  },
  "performance": {
    "min_ram_gb": 64,
    "recommended_ram_gb": 96,
    "download_size_gb": 40.0,
    "context_length_tokens": 131072,
    "estimated_inference_speed_tokens_per_sec": "~4-7 t/s (Apple M-series)"
  },
  "capabilities": {
    "languages_supported": [
      "en",
      "ro",
      "fr",
      "it",
      "es",
      "de"
    ],
    "suitable_for": [
      "calitate locală foarte ridicată; Mac Studio/Pro 64 GB+"
    ]
  },
  "license": {
    "type": "Llama 3.3 Community License",
    "url": "https://www.llama.com/llama3_3/license/",
    "commercial_use": true
  },
  "source": {
    "huggingface_url": "https://huggingface.co/mlx-community/Llama-3.3-70B-Instruct-4bit"
  },
  "verification": {
    "sha256_checksum": "",
    "ed25519_signature": "",
    "verification_notes": "NEVERIFICAT ÎNCĂ: checksum-ul se generează cu generate_checksums.sh după descărcarea greutăților .safetensors, iar semnătura Ed25519 se aplică cu cheia privată a proiectului (Secret Manager backend). Aplicația tratează câmpurile goale ca „integritate neverificată”, nu ca eroare."
  },
  "lexpenal_integration": {
    "swift_catalog_id": "mlx-community/Llama-3.3-70B-Instruct-4bit",
    "tier": "64+ GB",
    "use_in_app": "calitate locală foarte ridicată; Mac Studio/Pro 64 GB+"
  },
  "download_instructions": {
    "method": "Hugging Face Hub (automat, prin runtime-ul MLX din aplicație)",
    "expected_files": [
      "*.safetensors",
      "config.json",
      "tokenizer.json"
    ]
  }
}
