{
  "$schema": "https://raw.githubusercontent.com/raresmihailcristea-cmyk/lexpenal-models/main/schemas/model-manifest-v1.json",
  "manifest_version": "1.0",
  "model_id": "mlx-community/Mixtral-8x7B-Instruct-4bit",
  "name": "Mixtral 8x7B MoE (4-bit)",
  "vendor": "Mistral AI / mlx-community",
  "architecture": {
    "type": "MoE (Mixture of Experts)",
    "description": "8 sub-rețete Sparse Mixture of Experts, fiecare cu 7B parametri; doar ~12.9B activi per token"
  },
  "parameters": {
    "total_b": 46.7,
    "active_b": 12.9,
    "quantization": "4-bit (AWQ/GPTQ-equivalent)",
    "vocab_size": 32000,
    "num_layers": 32,
    "num_kv_heads": 8,
    "num_experts": 8,
    "experts_per_token": 2,
    "hidden_size": 4096,
    "ffn_hidden_size": 14336
  },
  "performance": {
    "min_ram_gb": 64,
    "recommended_ram_gb": 64,
    "download_size_gb": 26.0,
    "context_length_tokens": 32768,
    "estimated_inference_speed_tokens_per_sec": "~5-8 t/s (Mac Studio M2 Ultra / Mac Pro)"
  },
  "capabilities": {
    "languages_supported": [
      "en",
      "fr",
      "de",
      "es",
      "it",
      "pt",
      "ro"
    ],
    "suitable_for": [
      "analiză juridică complexă multi-step",
      "raționament legal profund",
      "generare concluzii scrise detaliate",
      "comparatie între surse juridice"
    ],
    "not_recommended_for": [
      "dispozitive cu < 64 GB RAM",
      "iPhone/iPad standard"
    ]
  },
  "license": {
    "type": "Apache License 2.0 + Mistral AI Research License",
    "url": "https://github.com/mistralai/mixtral/blob/main/LICENSE",
    "commercial_use": true,
    "modification_allowed": true,
    "distribution_allowed": true,
    "notes": "Mixtral este publicat sub licență Apache 2.0 de Mistral AI. Variantă quantizată de mlx-community păstrează aceeași licență."
  },
  "source": {
    "huggingface_url": "https://huggingface.co/mistralai/Mixtral-8x7B-Instruct-v0.1",
    "mlx_variant_url": "https://huggingface.co/mlx-community/Mixtral-8x7B-Instruct-4bit",
    "original_repo": "https://github.com/mistralai/mixtral"
  },
  "verification": {
    "sha256_checksum": "",
    "ed25519_signature": "",
    "verified_by": "LexPenalAI Model Security Team",
    "verified_at": "2025-07-22T00:00:00Z",
    "verification_notes": "NEVERIFICAT ÎNCĂ: checksum-ul se generează cu generate_checksums.sh după descărcarea greutăților, iar semnătura Ed25519 se aplică cu cheia privată a proiectului. Aplicația tratează câmpurile goale ca „integritate neverificată”, nu ca eroare."
  },
  "lexpenal_integration": {
    "swift_catalog_id": "mlx-community/Mixtral-8x7B-Instruct-4bit",
    "tier": "64 GB",
    "use_in_app": "analiză juridică premium on-device; generație documente complexe; doar Mac 64 GB+"
  },
  "download_instructions": {
    "method": "curl sau Hugging Face Hub CLI",
    "command_example": "huggingface-cli download mlx-community/Mixtral-8x7B-Instruct-4bit --local-dir ./mixtral-8x7b-4bit",
    "expected_files": [
      "*.safetensors",
      "*.index.json",
      "config.json",
      "tokenizer.model"
    ]
  }
}
